student@administrator-IdeaCentre-3-07IMB05:~/Desktop$ sudo service oracle-xe start
[sudo] password for student: 
student@administrator-IdeaCentre-3-07IMB05:~/Desktop$ sqlplus

SQL*Plus: Release 11.2.0.2.0 Production on Fri Nov 21 10:09:52 2025

Copyright (c) 1982, 2011, Oracle.  All rights reserved.

Enter user-name: student
Enter password: 

Connected to:
Oracle Database 11g Express Edition Release 11.2.0.2.0 - 64bit Production

SQL> create table countries(cid number(5),cname varchar2(25),ccode varchar2(25),primary key(cid));
create table countries(cid number(5),cname varchar2(25),ccode varchar2(25),primary key(cid))
             *
ERROR at line 1:
ORA-00955: name is already used by an existing object


SQL> create table countries2(cid number(5),cname varchar2(25),ccode varchar2(25),primary key(cid));

Table created.

SQL> insert into countries2 values(&cid,'&cname','&ccode');
Enter value for cid: 1
Enter value for cname: united states
Enter value for ccode: 25
old   1: insert into countries2 values(&cid,'&cname','&ccode')
new   1: insert into countries2 values(1,'united states','25')

1 row created.

SQL> /
Enter value for cid: 2
Enter value for cname: united kingdom
Enter value for ccode: 26
old   1: insert into countries2 values(&cid,'&cname','&ccode')
new   1: insert into countries2 values(2,'united kingdom','26')

1 row created.

SQL> select * from countries2;

       CID CNAME		     CCODE
---------- ------------------------- -------------------------
	 1 united states	     25
	 2 united kingdom	     26

SQL> create table states(sid number(5),sname varchar2(25),scode varchar2(25),primary key(sid));
create table states(sid number(5),sname varchar2(25),scode varchar2(25),primary key(sid))
             *
ERROR at line 1:
ORA-00955: name is already used by an existing object


SQL> create table states2(sid number(5),sname varchar2(25),scode varchar2(25)primary key(sid));
create table states2(sid number(5),sname varchar2(25),scode varchar2(25)primary key(sid))
                                                                                   *
ERROR at line 1:
ORA-00907: missing right parenthesis


SQL> create table states2(sid number(5),sname varchar2(25),scode varchar2(25),primary key(sid));

Table created.

SQL> insert into states2 values(&cid,'&sname','&scode');
Enter value for cid: 1
Enter value for sname: texas
Enter value for scode: 20
old   1: insert into states2 values(&cid,'&sname','&scode')
new   1: insert into states2 values(1,'texas','20')

1 row created.

SQL> /
Enter value for cid: 2
Enter value for sname: arizona
Enter value for scode: 21
old   1: insert into states2 values(&cid,'&sname','&scode')
new   1: insert into states2 values(2,'arizona','21')

1 row created.

SQL> select * from states2;

       SID SNAME		     SCODE
---------- ------------------------- -------------------------
	 1 texas		     20
	 2 arizona		     21

SQL> alter table states2 add cid number(5);

Table altered.

SQL> select * from states2;

       SID SNAME		     SCODE			      CID
---------- ------------------------- ------------------------- ----------
	 1 texas		     20
	 2 arizona		     21

SQL> update states2 set cid=1 where sid=1;

1 row updated.

SQL> update states2 set cid=1 where sid=2;

1 row updated.

SQL> select * from states2;

       SID SNAME		     SCODE			      CID
---------- ------------------------- ------------------------- ----------
	 1 texas		     20 				1
	 2 arizona		     21 				1

SQL> select * from countries2;

       CID CNAME		     CCODE
---------- ------------------------- -------------------------
	 1 united states	     25
	 2 united kingdom	     26

SQL> alter table states2 add constraint fk_states_countries_id foreign key(cid) references countries(cid) on delete cascade;
alter table states2 add constraint fk_states_countries_id foreign key(cid) references countries(cid) on delete cascade
                                   *
ERROR at line 1:
ORA-02264: name already used by an existing constraint


SQL> alter table states2 add constraint fk_states2_countries2_id foreign key(cid) references countries2(cid) on delete cascade;

Table altered.

SQL> delete from countries2 where cid=1;

1 row deleted.

SQL> select * from states2;

no rows selected

SQL> select * from countries2;

       CID CNAME		     CCODE
---------- ------------------------- -------------------------
	 2 united kingdom	     26

SQL> commit;

Commit complete.

